approval_id,sandbox_table,provider_id,botanical_name,common_name,species_id,approval_status,target_action,attribute_name,attribute_value,evidence_confidence,source_url,supplier_status,product_url,mowability_score,reviewer,review_date,review_notes
PA-DEMO-001,candidate_attributes.csv,PROV-SATIN,Achillea millefolium,Common Yarrow,BCNPPD-0001,approved,update_existing,Plant Type,Forb,Pending review,https://satinflower.ca/products/achillea-millefolium,,,,P18 demo,2026-07-03,Demo provider observation for user testing only; remains candidate pending review.
PA-DEMO-002,supplier_availability.csv,PROV-SATIN,Achillea millefolium,Common Yarrow,BCNPPD-0001,approved,record_supplier,,,Pending review,https://satinflower.ca/products/achillea-millefolium,available,https://satinflower.ca/products/achillea-millefolium,,P18 demo,2026-07-03,Demo supplier observation for user testing only.
PA-DEMO-003,mowability.csv,PROV-SATIN,Achillea millefolium,Common Yarrow,BCNPPD-0001,approved,record_mowability,,,Pending review,https://satinflower.ca/products/achillea-millefolium,,,3,P18 demo,2026-07-03,Demo provisional mowability observation for user testing only.
PA-DEMO-004,candidate_species.csv,PROV-PREMIER,Festuca rubra,red fescue,,approved,add_species,,,Pending review,https://premierpacificseeds.ca/products/,,,,P18 demo,2026-07-03,Demo new provider candidate pending taxonomy and Vancouver suitability review.
PA-DEMO-005,candidate_species.csv,PROV-WCS,Lactuca sativa,lettuce,,rejected,add_species,,,Pending review,https://www.westcoastseeds.com/products/lettuce,,,,P18 demo,2026-07-03,Rejected vegetable demo row; must not enter PoC.
